{"schemaVersion":3,"deviceName":"Parts Tally","profiles":[{"id":"bolts","name":"M3 bolts","lowStockThreshold":8,"calibrated":true,"provisional":false,"calibration":{"schemaVersion":2,"tareValid":true,"valid":true,"provisional":false,"tareCode":1000.5,"gramsPerCode":0.01,"unitMassGrams":2.5,"unitUncertaintyGrams":0.03,"calibrationResidualGrams":0.04,"knownCount":20,"createdMs":1200}}],"history":[{"sequence":1,"deviceUptimeMs":1250,"profileId":"bolts","kind":"count","eventId":"count-1","reason":"","count":41},{"sequence":2,"deviceUptimeMs":1300,"profileId":"bolts","kind":"correction","eventId":"correction-2","relatedEventId":"count-1","reason":"manual recount","count":42}]}
